zagolovok,date,age,domain
Four ways Bob Corker skewered Donald Trump - BBC News,9 October 2017,Reg. Date: 1989-07-15,bbc.com
"Linklater's war veteran comedy speaks to modern America, says star | Reuters",,Reg. Date: 1993-06-03,reuters.com
Trump’s Fight With Corker Jeopardizes His Legislative Agenda - The New York Times,"Oct. 9, 2017",Reg. Date: 1994-01-18,nytimes.com
Egypt's Cheiron wins tie-up with Pemex for Mexican onshore oil field | Reuters,,Reg. Date: 1993-06-03,reuters.com
JetNation FanDuel League; Week 4 | Sports | Before It's News,"
Wednesday, September 27, 2017 14:42 ",Reg. Date: 2007-09-15,beforeitsnews.com
Kansas Tried a Tax Plan Similar to Trump’s. It Failed. - The New York Times,"Oct. 10, 2017",Reg. Date: 1994-01-18,nytimes.com
"India RBI chief: growth important, but not at cost of inflation - newspaper | Reuters",,Reg. Date: 1993-06-03,reuters.com
EPA chief to sign rule on Clean Power Plan exit on Tuesday | Reuters,,Reg. Date: 1993-06-03,reuters.com
Talks on sale of Air Berlin planes to easyJet at risk of collapse: report | Reuters,,Reg. Date: 1993-06-03,reuters.com
"U.S. President Donald Trump Quietly Signs Law To Allow Warrantless Searches In Parts Of VA, DC and MD","September 26, 2017",Reg. Date: 2010-04-23,activistpost.com
2017 Fantasy Football Team Defense Rankings – Week 5 | Sports | Before It's News,"
Wednesday, October 4, 2017 4:17 ",Reg. Date: 2007-09-15,beforeitsnews.com
Just Shut Up & Play Some Damn Baseball!! | Sports | Before It's News,"
Monday, September 25, 2017 5:17 ",Reg. Date: 2007-09-15,beforeitsnews.com
Deloitte cyber attack affected up to 350 clients: Guardian | Reuters,,Reg. Date: 1993-06-03,reuters.com
"10/7: Chuck Axed; HBD Brickyard, Adam, Moonlight Ace & Chuck; AS; Season Finales... | Sports | Before It's News","
Saturday, October 7, 2017 4:09 ",Reg. Date: 2007-09-15,beforeitsnews.com
Gunman’s Girlfriend Said She Didn’t Know He Planned Harm - The New York Times,"Oct. 4, 2017",Reg. Date: 1994-01-18,nytimes.com
"Marilou Danley, Gunman’s Girlfriend, Says She Was Unaware of His Plans - The New York Times","Oct. 4, 2017",Reg. Date: 1994-01-18,nytimes.com
Trump’s Immigration Rhetoric Echoes a Bitter Fight in the 90s - The New York Times,"By Retro Report •October 9, 2017",Reg. Date: 1994-01-18,nytimes.com
Weinstein Co board ousts Harvey Weinstein after harassment allegations | Reuters,,Reg. Date: 1993-06-03,reuters.com
Hillary Clinton Suggests That Trump May Order the Murder of Journalists | U. S. Politics | Before It's News,"
Wednesday, September 27, 2017 10:27 ",Reg. Date: 2007-09-15,beforeitsnews.com
Sharapova storms into Tianjin quarter-finals | Reuters,,Reg. Date: 1993-06-03,reuters.com
"With Christian Pulisic Driving, United States Steers Closer to World Cup - The New York Times","Oct. 6, 2017",Reg. Date: 1994-01-18,nytimes.com
'Hard' Brexit seen dire for Dutch but far worse for Brits: Rabobank | Reuters,,Reg. Date: 1993-06-03,reuters.com
"Weakening Nate brings rain, tornado warnings to U.S. South | Reuters",,Reg. Date: 1993-06-03,reuters.com
PA Attorney General Concerned About Equifax Cyberattack; Will U.S. Attorneys General Be Upset About Utility Smart Meters Hacking?,"October 3, 2017",Reg. Date: 2010-04-23,activistpost.com
Trump Administration Formally Lifts Sanctions on Sudan - The New York Times,"Oct. 6, 2017",Reg. Date: 1994-01-18,nytimes.com
Mexico plans aid for Puerto Rico after Hurricane Maria | Reuters,,Reg. Date: 1993-06-03,reuters.com
"10/1 Expo Park-Forbes Field Era: Deacon Whips Cy In 1st WS Game, Waner's 237 Hits, Boss Man Roberto & More | Sports | Before It's News","
Sunday, October 1, 2017 4:09 ",Reg. Date: 2007-09-15,beforeitsnews.com
Five arrested in Delhi over assault on Nigerian - BBC News,11 October 2017,Reg. Date: 1989-07-15,bbc.com
Google Clips Automatically Identifies Everyone Including Your Pets,"October 9, 2017",Reg. Date: 2010-04-23,activistpost.com
2017 Fantasy Football Kicker Rankings – Week 4 | Sports | Before It's News,"
Wednesday, September 27, 2017 4:17 ",Reg. Date: 2007-09-15,beforeitsnews.com
What Would Happen To You in The Microwave? | U. S. Politics | Before It's News,"
Thursday, September 28, 2017 4:35 ",Reg. Date: 2007-09-15,beforeitsnews.com
Upgrading to a Modern Mac - The New York Times,"Oct. 5, 2017",Reg. Date: 1994-01-18,nytimes.com
Newton Laughs at Female Reporter After Asking a Question About WR Routes | Sports | Before It's News,"
Wednesday, October 4, 2017 20:43 ",Reg. Date: 2007-09-15,beforeitsnews.com
Las Vegas Police Deny NFL’s Michael Bennett Was Racially Profiled as Video Rebuts Player’s Claims | U. S. Politics | Before It's News,"
Saturday, September 30, 2017 14:18 ",Reg. Date: 2007-09-15,beforeitsnews.com
World Cup 2018: What are England boss Gareth Southgate's big challenges? - BBC Sport,6 October 20176 October 2017,Reg. Date: 1989-07-15,bbc.com
"10/7: Chuck Axed; HBD Brickyard, Adam, Moonlight Ace & Chuck; AS; Season Finales... | Sports | Before It's News","
Saturday, October 7, 2017 4:09 ",Reg. Date: 2007-09-15,beforeitsnews.com
Pumpkin Spiced White Hot Chocolate | U. S. Politics | Before It's News,"
Saturday, September 30, 2017 15:02 ",Reg. Date: 2007-09-15,beforeitsnews.com
Duping Americans And Wasting Taxpayers’ Money,"September 28, 2017",Reg. Date: 2010-04-23,activistpost.com
Nibiru Final Warning - ‘Just How Long Does Earth Have Left Before Planet X Doom’ | U. S. Politics | Before It's News,"
Monday, October 9, 2017 6:20 ",Reg. Date: 2007-09-15,beforeitsnews.com
In 2000 The Simpsons Predicted The Donald Trump Presidency - DailyBuzzLive.com,,Reg. Date: 2013-09-20,dailybuzzlive.com
Are Dems’ Late-Night Sock Puppets a Sign that the Fairness Doctrine Should be Restored? | U. S. Politics | Before It's News,"
Sunday, October 8, 2017 7:10 ",Reg. Date: 2007-09-15,beforeitsnews.com
Ben Stokes: England all-rounder loses New Balance sponsorship - BBC Sport,11 October 201711 October 2017,Reg. Date: 1989-07-15,bbc.com
"Very Violent Reversal Before End of 2017, North Korea Thinks US Is Bluffing – James Rickards, Greg Hunter Video | Opinion - Conservative | Before It's News","
Tuesday, October 3, 2017 22:57 ",Reg. Date: 2007-09-15,beforeitsnews.com
"New Documents Show Pentagon Is Shipping Billions Worth Of Weapons To Terrorists In Syria, Trying To Cover Its Tracks","September 15, 2017",Reg. Date: 2010-04-23,activistpost.com
Mom Puts Glasses on Her Baby – Watch Her Face As She Sees Her Dad for the First Time - DailyBuzzLive.com,,Reg. Date: 2013-09-20,dailybuzzlive.com
"A ‘Dynasty’ for Generation ‘Gossip Girl’ (Mom Can Watch, Too) - The New York Times","Oct. 6, 2017",Reg. Date: 1994-01-18,nytimes.com
"Disney, Hillary Clinton and the Obamas Condemn Weinstein - The New York Times","Oct. 10, 2017",Reg. Date: 1994-01-18,nytimes.com
MacArthur Foundation Fellows: Winners List - The New York Times,"Oct. 11, 2017",Reg. Date: 1994-01-18,nytimes.com
Safeway Open: Brendan Steele wins title for second year in succession - BBC Sport,9 October 20179 October 2017,Reg. Date: 1989-07-15,bbc.com
CNN Hero Mona Patel: Sparkle Twins - CNN Video,,Reg. Date: 1993-09-22,cnn.com
Netflix fends off criticism over Canada investment | Reuters,,Reg. Date: 1993-06-03,reuters.com
Kenyan Election Officials Open New Vote to All Original Candidates - The New York Times,"Oct. 11, 2017",Reg. Date: 1994-01-18,nytimes.com
,,,
12 Rohingya refugees killed after boat capsizes between Myanmar and Bangladesh | CNN,,Reg. Date: 1993-09-22,cnn.com
Nelly arrested on suspicion of rape - CNN Video,,Reg. Date: 1993-09-22,cnn.com
"Happy 350,000th birthday: Study pushes back Homo sapiens origins | Reuters",,Reg. Date: 1993-06-03,reuters.com
Kids & Fitness....Get the Kids Off the Couch & Have Some Fun! | Sports | Before It's News,"
Monday, September 25, 2017 8:35 ",Reg. Date: 2007-09-15,beforeitsnews.com
Exclusive: EU regulators set to approve Atlantia's bid for Abertis - sources | Reuters,,Reg. Date: 1993-06-03,reuters.com
"New Documents Show Pentagon Is Shipping Billions Worth Of Weapons To Terrorists In Syria, Trying To Cover Its Tracks","September 15, 2017",Reg. Date: 2010-04-23,activistpost.com
Wonder Woman’s Surprising Back Story Has a Film of Its Own - The New York Times,"Oct. 11, 2017",Reg. Date: 1994-01-18,nytimes.com
Mom Fights Back Home Invaders On Detroit's West Side,,Reg. Date: 2013-09-20,dailybuzzlive.com
'Dancing With the Stars' Las Vegas tribute | CNN,,Reg. Date: 1993-09-22,cnn.com
Can You be Hacked by the World Around You?,"October 12, 2017",Reg. Date: 2010-04-23,activistpost.com
"10/5 TRS-PNC Park: Bucs Win in '71, '79; Lose Four Playoffs (Dang Reds!); Tracy Fired | Sports | Before It's News","
Thursday, October 5, 2017 5:57 ",Reg. Date: 2007-09-15,beforeitsnews.com
"U.S. insured wind, storm surge loss from Hurricane Nate around $500 million: KCC | Reuters",,Reg. Date: 1993-06-03,reuters.com
The online bots behind Vladimir Putin's birthday wishes - BBC News,12 October 2017,Reg. Date: 1989-07-15,bbc.com
Rose McGowan Attacks Ben Affleck Over Harvey Weinstein: ‘You Lie’ - The New York Times,"Oct. 10, 2017",Reg. Date: 1994-01-18,nytimes.com
"Mexico warns U.S. against 'protectionist war,' peso weakens | Reuters",,Reg. Date: 1993-06-03,reuters.com
Weinstein and the media's shame - BBC News,9 October 2017,Reg. Date: 1989-07-15,bbc.com
"Broken2th And Crystal Sun Release ""Castaliah"" | Entertainment | Before It's News","
Monday, September 18, 2017 14:00 ",Reg. Date: 2007-09-15,beforeitsnews.com
Audio Released of Hotel Worker Warning of Shooter BEFORE Vegas Massacre,"October 11, 2017",Reg. Date: 2010-04-23,activistpost.com
The rising profile of football in Australia - BBC News,11 October 2017,Reg. Date: 1989-07-15,bbc.com
Women Absorb And Retain DNA From Every Man They Have Sex With,,Reg. Date: 2013-09-20,dailybuzzlive.com
U.S. House approves disaster funds as Trump criticizes Puerto Rico | Reuters,,Reg. Date: 1993-06-03,reuters.com
"Elliott again ups Hitachi Kokusai stake, KKR raises offer price | Reuters",,Reg. Date: 1993-06-03,reuters.com
20 holiday destinations the experts say not to miss | CNN Travel,,Reg. Date: 1993-09-22,cnn.com
"Fed Still Puzzled by Inflation, but Rate Increase Is on Track - The New York Times","Oct. 11, 2017",Reg. Date: 1994-01-18,nytimes.com
Nobel Prize in medicine: US body clock scientists win | CNN,,Reg. Date: 1993-09-22,cnn.com
Trump Poised to Sign Order Opening New Paths to Health Insurance - The New York Times,"Oct. 7, 2017",Reg. Date: 1994-01-18,nytimes.com
The Shocking Carol Woods Coverup: POLICE ALTER RECORDS + archive 11 Sept. 2017 | Scandals | Before It's News,"
Monday, September 11, 2017 12:07 ",Reg. Date: 2007-09-15,beforeitsnews.com
Highlights of Sunday's MLB playoff games | Reuters,,Reg. Date: 1993-06-03,reuters.com
Is 16th-century charcoal sketch a naked Mona Lisa? | Reuters,,Reg. Date: 1993-06-03,reuters.com
Hero who saved 30 people reunited with officer who saved his own life | CNN,,Reg. Date: 1993-09-22,cnn.com
Pakistan v Sri Lanka: Tourists win second Test by 68 runs to take series 2-0 - BBC Sport,10 October 201710 October 2017,Reg. Date: 1989-07-15,bbc.com
Trump Administration Urges Congress To Renew Foreign Intelligence Surveillance Act (FISA),"September 13, 2017",Reg. Date: 2010-04-23,activistpost.com
Theresa May needs to resign for the good of Britain | CNN,,Reg. Date: 1993-09-22,cnn.com
"Employers Can Now Refuse to Pay for Birth Control, Thanks To Trump | U. S. Politics | Before It's News","
Friday, October 6, 2017 23:43 ",Reg. Date: 2007-09-15,beforeitsnews.com
Teacher Told Students They Were ‘Too Dark-Skinned’ To Play Lincoln | U. S. Politics | Before It's News,"
Thursday, September 28, 2017 6:35 ",Reg. Date: 2007-09-15,beforeitsnews.com
Kaspersky's U.S. spat a sign of Balkanisation in cyber world: Interpol | Reuters,,Reg. Date: 1993-06-03,reuters.com
Rohingya crisis: Finding out the truth about Arsa militants - BBC News,11 October 2017,Reg. Date: 1989-07-15,bbc.com
Wall Street Vs. Kremlin: Who Really Runs The White House?,"October 1, 2017",Reg. Date: 2010-04-23,activistpost.com
Hungary’s “Wall” Versus the U.S. “Wall”: What’s The Difference?,"October 12, 2017",Reg. Date: 2010-04-23,activistpost.com
Highlights: Hong Kong leader Carrie Lam delivers maiden policy address | Reuters,,Reg. Date: 1993-06-03,reuters.com
War on Cash Backfires on India’s Economy,"September 7, 2017",Reg. Date: 2010-04-23,activistpost.com
"Trump Threatens WW3 ""Reviewing Plans To Send Weapons To Ukraine""","September 6, 2017",Reg. Date: 2010-04-23,activistpost.com
China's COMAC says C919's third test flight delayed due to bad weather | Reuters,,Reg. Date: 1993-06-03,reuters.com
Harvey Weinstein Is Gone. But Hollywood Still Has a Problem. - The New York Times,"Oct. 11, 2017",Reg. Date: 1994-01-18,nytimes.com
Harlem hatter brings past to life​ - CNN Video,,Reg. Date: 1993-09-22,cnn.com
How we tick: U.S. 'body clock' scientists win Nobel medicine prize | Reuters,,Reg. Date: 1993-06-03,reuters.com
What a shot! 29 amazing sports photos,,Reg. Date: 1993-09-22,cnn.com
Intimidation of 9/11 Commission Witnesses: The “Minders”,"September 15, 2017",Reg. Date: 2010-04-23,activistpost.com
"Drained of cash and riven by rivalries, UNESCO seeks leader to revive fortunes | Reuters",,Reg. Date: 1993-06-03,reuters.com
Video Released of Elderly German Captive Beheaded by Islamic State - DailyBuzzLive.com,,Reg. Date: 2013-09-20,dailybuzzlive.com
Review: Money Can’t Buy the New ‘Dynasty’ Excitement - The New York Times,"Oct. 10, 2017",Reg. Date: 1994-01-18,nytimes.com
Iraq forces retake town of Hawija from IS - BBC News,5 October 2017,Reg. Date: 1989-07-15,bbc.com
‘Fixed Upper’ Stars Announce Final Season – really | U. S. Politics | Before It's News,"
Wednesday, September 27, 2017 5:59 ",Reg. Date: 2007-09-15,beforeitsnews.com
Las Vegas: Bombshell Video Shows Second Shooter During Vegas Massacre The Alex Jones Channel | Blogging/Citizen Journalism | Before It's News,"
Wednesday, October 4, 2017 12:33 ",Reg. Date: 2007-09-15,beforeitsnews.com
California Seeks Ban On Fossil Fuel Cars Laying The Groundwork To Ban Humans From The Road,"September 30, 2017",Reg. Date: 2010-04-23,activistpost.com
Las Vegas massacre: How a stranger saved a woman's life | CNN,,Reg. Date: 1993-09-22,cnn.com
Blue Martinez | Entertainment | Before It's News,"
Thursday, September 21, 2017 17:57 ",Reg. Date: 2007-09-15,beforeitsnews.com
Trump lays into ESPN anchor suspended over tweets - BBC News,10 October 2017,Reg. Date: 1989-07-15,bbc.com
Hosting Proms and Selling Cows: North Korean Embassies Scrounge for Cash - The New York Times,"Oct. 7, 2017",Reg. Date: 1994-01-18,nytimes.com
Catalan Independence: 5 Things to Think About,"October 1, 2017",Reg. Date: 2010-04-23,activistpost.com
The Castration Cure | Entertainment | Before It's News,"
Sunday, September 17, 2017 10:17 ",Reg. Date: 2007-09-15,beforeitsnews.com
Noah: Trump should pretend to like Puerto Rico - CNN Video,,Reg. Date: 1993-09-22,cnn.com
Brazilian activist awarded for fight against Amazon rainforest dam | Reuters,,Reg. Date: 1993-06-03,reuters.com
Just Shut Up & Play Some Damn Baseball!! | Sports | Before It's News,"
 Monday, September 25, 2017 5:17 ",Reg. Date: 2007-09-15,beforeitsnews.com
New Oregon Law will Help Facilitate the Sale of Industrial Hemp Products,"October 11, 2017",Reg. Date: 2010-04-23,activistpost.com
UK tech firm Micro Focus to curb code reviews by 'high risk' governments | Reuters,,Reg. Date: 1993-06-03,reuters.com
Hangover Win | Sports | Before It's News,"
Monday, September 25, 2017 22:28 ",Reg. Date: 2007-09-15,beforeitsnews.com
Quantum Computer in a Nutshell | Entertainment | Before It's News,"
Monday, September 18, 2017 13:01 ",Reg. Date: 2007-09-15,beforeitsnews.com
Brooke Shields reveals Trump asked her out - CNN Video,,Reg. Date: 1993-09-22,cnn.com
Police take shot at actor on movie set - CNN Video,,Reg. Date: 1993-09-22,cnn.com
Game Photos: Michigan at Purdue | Sports | Before It's News,"
Monday, September 25, 2017 9:25 ",Reg. Date: 2007-09-15,beforeitsnews.com
New York Architects Chosen for Major New London Concert Hall - The New York Times,"Oct. 10, 2017",Reg. Date: 1994-01-18,nytimes.com
Plus size model Ashley Graham shames those who troll her workout videos - BBC News,9 October 2017,Reg. Date: 1989-07-15,bbc.com
Australia's AMP buys U.S. logistics group from Carlyle | Reuters,,Reg. Date: 1993-06-03,reuters.com
"Russia's Putin, eyeing election next year, pledges to prosecute vote violations | Reuters",,Reg. Date: 1993-06-03,reuters.com
Freedom Exists Under Natural Law,"October 2, 2017",Reg. Date: 2010-04-23,activistpost.com
"In John Green’s ‘Turtles All the Way Down,’ a Teenager’s Mind Is at War With Itself - The New York Times","Oct. 10, 2017",Reg. Date: 1994-01-18,nytimes.com
Kyrgios finds purpose in helping underprivileged children | Reuters,,Reg. Date: 1993-06-03,reuters.com
World Cup 2018 - which 32 teams have qualified for Russia? - BBC Sport,21 November 201721 November 2017,Reg. Date: 1989-07-15,bbc.com
China says hopes Iran nuclear deal stays intact amid Trump criticism | Reuters,,Reg. Date: 1993-06-03,reuters.com
New Coach Reminds Fans That Purdue Has a Football Team - The New York Times,"Oct. 6, 2017",Reg. Date: 1994-01-18,nytimes.com
China Open: Caroline Garcia beats world number one Simona Halep to take title - BBC Sport,8 October 20178 October 2017,Reg. Date: 1989-07-15,bbc.com
"A Veteran Asks, ""What’s Worse, a Kneeling Millionaire or 300,000 Vets Neglected to Death?""","September 26, 2017",Reg. Date: 2010-04-23,activistpost.com
Hand Feeding Humming Birds - AMAZING!,,Reg. Date: 2013-09-20,dailybuzzlive.com
"Las Vegas Bombshell: Video Appears to Show Muzzle-Flash From 4th Floor, Not 32nd (Video) | Prophecy | Before It's News","
Monday, October 2, 2017 14:00 ",Reg. Date: 2007-09-15,beforeitsnews.com
How a businessman struck a deal with Islamic State to help Assad feed Syrians | Reuters,,Reg. Date: 1993-06-03,reuters.com
A transgender midshipman fights Trump's ban - CNN Video,,Reg. Date: 1993-09-22,cnn.com
EU says 'ball entirely in UK court' for move to next Brexit talks phase | Reuters,,Reg. Date: 1993-06-03,reuters.com
Review: Shakespeare Meets Elevator Repair Service. Mayhem Ensues. - The New York Times,"Nov. 5, 2017",Reg. Date: 1994-01-18,nytimes.com
United States miss out on World Cup after Trinidad loss | Reuters,,Reg. Date: 1993-06-03,reuters.com
"Indians’ Secret Weapon May Be Yan Gomes, Their Catcher From Brazil - The New York Times","Oct. 11, 2017",Reg. Date: 1994-01-18,nytimes.com
Police Are Looking For These 2 Creepy Masked Figures That Appeared In The Woods,,Reg. Date: 2013-09-20,dailybuzzlive.com
Sold Out: The Underground Economy of Supreme Resellers | Entertainment | Before It's News,"
Wednesday, September 20, 2017 15:09 ",Reg. Date: 2007-09-15,beforeitsnews.com
"In Cuba, Sourcing Style - The New York Times","Oct. 7, 2017",Reg. Date: 1994-01-18,nytimes.com
"Linklater's war veteran comedy speaks to modern America, says star | Reuters",,Reg. Date: 1993-06-03,reuters.com
Germany's Schaeuble backs ECB plans on bad loans | Reuters,,Reg. Date: 1993-06-03,reuters.com
Trump’s Cabinet Travels In Style At The Expense Of Tax Payers | U. S. Politics | Before It's News,"
Monday, October 9, 2017 7:10 ",Reg. Date: 2007-09-15,beforeitsnews.com
German Foreign Policy Experts Warn Against Anti-Americanism - The New York Times,"Oct. 11, 2017",Reg. Date: 1994-01-18,nytimes.com
California Clothing Store Owner’s Trump as Nazi Billboard Backfires Big Time | U. S. Politics | Before It's News,"
Sunday, October 8, 2017 6:58 ",Reg. Date: 2007-09-15,beforeitsnews.com
Mommy Signed Her Up For Preschool. Her 'Rundown' Of The Day Has The Internet In Laughter,,Reg. Date: 2013-09-20,dailybuzzlive.com
"Spark gene therapy improves vision, at least in short term: FDA | Reuters",,Reg. Date: 1993-06-03,reuters.com
Financialization and The Destruction of the Real Economy,"September 21, 2017",Reg. Date: 2010-04-23,activistpost.com
"U.S. Suspends Visa Services in Turkey, and Turkey Responds in Kind - The New York Times","Oct. 8, 2017",Reg. Date: 1994-01-18,nytimes.com
"At Queens Museum, the Director Is as Political as the Art - The New York Times","Oct. 8, 2017",Reg. Date: 1994-01-18,nytimes.com
,,,
SpaceX: BFR Will go from any city to any other city on Earth in under an hour | U. S. Politics | Before It's News,"
Friday, September 29, 2017 6:19 ",Reg. Date: 2007-09-15,beforeitsnews.com
,,,
She Was About to Quit Acting. Then She Got the Role of a Lifetime. - The New York Times,"Oct. 11, 2017",Reg. Date: 1994-01-18,nytimes.com
"Where Video Game Conventions Draw 300,000: Not in the U.S. - The New York Times","Oct. 4, 2017",Reg. Date: 1994-01-18,nytimes.com
What will Trump do about the Iran nuclear deal? - BBC News,12 October 2017,Reg. Date: 1989-07-15,bbc.com
Obama cries seeing Malia off to college - CNN Video,,Reg. Date: 1993-09-22,cnn.com
What a shot! 32 amazing sports photos,,Reg. Date: 1993-09-22,cnn.com
Mysterious DHS Towers In NYC - Are These Radiation Detectors?,"October 4, 2017",Reg. Date: 2010-04-23,activistpost.com
Brazil congressional report recommends shelving Temer charges | Reuters,,Reg. Date: 1993-06-03,reuters.com
,,,
Snapchat and Jeff Koons Collaborate on Augmented Reality Art Project - The New York Times,"Oct. 3, 2017",Reg. Date: 1994-01-18,nytimes.com
"9/11 Gave Us the Police State With the ""Patriot"" Act, After Vegas Get Ready for ""USA Liberty"" Act","October 6, 2017",Reg. Date: 2010-04-23,activistpost.com
Can we tell if Donald Trump has a high IQ? - BBC News,11 October 2017,Reg. Date: 1989-07-15,bbc.com
UN Allegedly Nixed A Report That Predicted The Rohingya Crisis | U. S. Politics | Before It's News,"
Thursday, October 5, 2017 12:44 ",Reg. Date: 2007-09-15,beforeitsnews.com
,,,
Top 100 European Innovative Universities Comparison ,,Reg. Date: 1993-06-03,reuters.com
,,,
,,,
,,,
,,,
,,,
,,,
,,,
2 gay Iraqi soldiers found love amid war -- then fled to the US - CNN,"Updated 12:02 PM ET, Sun October 8, 2017",Reg. Date: 1993-09-22,cnn.com
The flight routines of super-travellers - BBC Worklife,,Reg. Date: 1989-07-15,bbc.com
,,,
"At Queens Museum, the Director Is as Political as the Art - The New York Times","Oct. 8, 2017",Reg. Date: 1994-01-18,nytimes.com
"Google uncovered Russia-backed ads on YouTube, Gmail : source | Reuters",,Reg. Date: 1993-06-03,reuters.com
,,,
,,,
MacArthur Foundation Names 2017 ‘Genius’ Grant Winners - The New York Times,"Oct. 11, 2017",Reg. Date: 1994-01-18,nytimes.com
"Brexit talks deadlock on cash, Barnier eyes move by December | Reuters",,Reg. Date: 1993-06-03,reuters.com
,,,
"Ah! My kid is having a tantrum, and I want to scream | CNN",,Reg. Date: 1993-09-22,cnn.com
Hollywood reacts to Harvey Weinstein abuse claims - BBC News,6 October 2017,Reg. Date: 1989-07-15,bbc.com
,,,
"'Blade Runner,' 'Westworld' test our empathy | CNN",,Reg. Date: 1993-09-22,cnn.com
World Cup 2018: Arjen Robben retires from Netherlands duty after Sweden defeat - BBC Sport,TUE 10 Oct 2017,Reg. Date: 1989-07-15,bbc.com
,,,
,,,
Conway: We're doing what we can in Puerto Rico - CNN Video,,Reg. Date: 1993-09-22,cnn.com
,,,
,,,
Diary of Anne Frank transformed into graphic adaptation - BBC News,11 October 2017,Reg. Date: 1989-07-15,bbc.com
,,,
,,,
The Premier League Show: Why Crystal Palace are perfect for Wilfried Zaha - Gabby Logan - BBC Sport,11 October 201711 October 2017,Reg. Date: 1989-07-15,bbc.com
How a Foreign Policy of Empire Building Will Destroy the United States - Activist Post,"September 28, 2017",Reg. Date: 2010-04-23,activistpost.com
,,,
The graphic design that can help save lives - BBC Future,,Reg. Date: 1989-07-15,bbc.com
,,,
,,,
,,,
,,,
,,,
Have you ever seen a miss worse than this? Dutch footballer blasts over from close range - BBC Sport,9 October 2017,Reg. Date: 1989-07-15,bbc.com
Puerto Rican Police Officer: San Juan Mayor not allowing distribution of aid supplies | U. S. Politics | Before It's News,"
Sunday, October 1, 2017 9:58 ",Reg. Date: 2007-09-15,beforeitsnews.com
,,,
,,,
'SNL' returns with Trump mockery - CNN Video,,Reg. Date: 1993-09-22,cnn.com
Barcelona's African street traders swap crime for craft | Reuters,,Reg. Date: 1993-06-03,reuters.com
,,,
Srebrenica defender Naser Oric cleared of war crimes in Sarajevo - BBC News,9 October 2017,Reg. Date: 1989-07-15,bbc.com
"Xi Jinping Presses Military Overhaul, and Two Generals Disappear - The New York Times","Oct. 11, 2017",Reg. Date: 1994-01-18,nytimes.com
,,,
,,,
,,,
Vital: The Real Dreamers are Elite Corporations,"September 18, 2017",Reg. Date: 2010-04-23,activistpost.com
,,,
,,,
,,,
North Korea: Trump has 'lit the wick' of war | CNN Politics,,Reg. Date: 1993-09-22,cnn.com
,,,
The best former professional athlete to run a sports team | Reuters,,Reg. Date: 1993-06-03,reuters.com
Smart Billboards Target Individual Motorists and Spy on License Plates and Cellphones,"September 28, 2017",Reg. Date: 2010-04-23,activistpost.com
,,,
,,,
Tropical Storm Ophelia expected to strengthen to hurricane by Thursday | Reuters,,Reg. Date: 1993-06-03,reuters.com
,,,
Stars give their tips on getting your music heard - BBC News,6 October 2017,Reg. Date: 1989-07-15,bbc.com
Brazil wants $12.7 billion fine on Andrade engineering firm: O Globo | Reuters,,Reg. Date: 1993-06-03,reuters.com
,,,
,,,
,,,
Raiders Throw Game to Punish QB Who Wouldn’t Protest Trump – Where Is Roger Goodell Now? | Scandals | Before It's News,"
Sunday, October 1, 2017 3:47 ",Reg. Date: 2007-09-15,beforeitsnews.com
'Heroin heroine' saves lives from her living room | CNN,,Reg. Date: 1993-09-22,cnn.com
Australia dual citizenship saga: Court hearing begins - BBC News,10 October 2017,Reg. Date: 1989-07-15,bbc.com
"Oh, rats! Big tree-dwelling rodent found in Solomon Islands | Reuters",,Reg. Date: 1993-06-03,reuters.com
What the UK and Australia did differently after mass shootings | CNN,,Reg. Date: 1993-09-22,cnn.com
